"","asin","product_name","sku","price_cleaning","native_price","discount_percentage","date","X..i.."
"264","B015O6J85C","Imetec Bellissima Zero Ultra Fast Epilatore a Luce Pulsata, Fast HPL Plus Technology, Doppio Sistema di Protezione della Pelle e Touch Sensor, 5 Livelli Di Energia Luminosa, fino a 300000 Impulsi","0","89.99","0","0","1665717657.32159",NA
"265","B009E7AKA0",NA,"0",NA,"0","0","1665717677.35743",NA
"266","B01M1BX2RL","Imetec Bellissima Zero Pro Dual Epilatore a Luce Pulsata Tecnologia HPL&Galavnic, Doppio Sistema di Protezione della Pelle,5 Livelli di Energia Luminosa, Lampada Quartz,fino a 400.000 Impulsi di Luce","0","253.4","0","0","1665717699.12868",NA
"267","B01M0149BP",NA,"0",NA,"0","0","1665717719.12424",NA
"268","B0728PHKBL","Imetec Bellissima Flash&Go Pro Epilatore a Luce Pulsata per la Riduzione Permanente dei Peli Superflui di Viso e Corpo, 350.000 Impulsi, Utilizzabile Anche su Pelle Abbronzata a Livelli 1 e 2","0","98.99","0","0","1665717741.00416",NA
"269","B007M906CE","Imetec Bellissima ET1 200 Epilatore Meccanico, Doppia Testina, Funzione Waterproof, 90 Minuti di Autonomia","0","72.68","0","0","1665717763.29901",NA
"270","B075RGNCZQ","Bellissima Imetec Comfort Lady Rasoio Elettrico per Donna, Wet&Dry, Lame Arrotondate e Oscillanti","0","34.99","0","0","1665717785.51367",NA
"271","B078LJX5GY",NA,"0",NA,"0","0","1665717805.61568",NA
"272","B07P8VM7P7","Bellissima Imetec Flash&Go Lampada di Ricambio per Epilatore a Luce Pulsata, Superficie della Lampada 4 cm², Filtro UV, Fino a 5000 Flash","0","29.1","0","0","1665717827.98067",NA
"273","B00JZOO2UG","Imetec Intellisense Plaid Riscaldabile Singolo, Termocoperta con Tecnologia Intellisense, Morbida Microfibra Bicolore Reversibile, Lavabile in Lavatrice, 150 x 90 cm","0","49.99","0","0","1665717849.92232",NA
"274","B0056BY2Q6","Imetec Intellisense Plaid Riscaldabile Matrimoniale, Termocoperta con Tecnologia Intellisense, Morbida Microfibra Bicolore Reversibile, Lavabile in Lavatrice, 180 x 140 cm","0","85","0","0","1665717872.34694",NA
"275","B005TVOC3G","Imetec Softly Scaldaletto, 50% Lana, Matrimoniale","0","87.9","0","0","1665717894.69918",NA
"276","B00563GAPA",NA,"0",NA,"0","0","1665717914.74014",NA
"277","B0056C02MI","Imetec Scaldasonno Matrimoniale 150x160 cm, 50% Lana e Merino, 2 Temperature, Dispositivo Sicurezza Electro Block, Made in Italy","0","143.9","0","0","1665717936.77888",NA
"278","B00563PPGA","Imetec 6012D Scaldasonno Premium, Tessuto Trapuntato, Scaldaletto Matrimoniale","0","109.51","0","0","1665717959.16112",NA
"279","B005658E1Q",NA,"0",NA,"0","0","1665717979.2347",NA
"280","B0056BZZDA",NA,"0",NA,"0","0","1665717999.4797",NA
"281","B0056BZZAI","Imetec 6001D Scaldasonno Premium, Tessuto Trapuntato, Scaldaletto Singolo","0","59.14","0","0","1665718021.99226",NA
"282","B00M975Z5W","Imetec 16176A Scaldasonno Sensitive Matrimoniale, si Adatta ai Cambi di Temperatura, Morbido Peluche, Coprimaterasso Maxi 190 x 160, Electro Block, 6 Temperature, Timer, Risparmio Energetico, Lavabile","0","144.99","0","0","1665718043.94243",NA
"283","B008OFBLYC","Imetec Relaxy Intellisense CHP 01 Termoforo Cervicale, Comando Digitale con 5 Temperature con Riscaldamento Rapido, Tessuto in Microfibra Anallergico, Lavabile, Dimensioni 42 x 38 cm","0",NA,"0","0","1665718066.1238",NA
"284","B008OFBLR4","Almohadilla Termica Imetec Rectang 40X35","0","34.99","0","0","1665718087.99362",NA
"285","B078RL1X78",NA,"0",NA,"0","0","1665718108.06953",NA
"286","B01LXFEQXU","Imetec 16284 Scaldasonno Express Singolo, Tecnologia Express Rapido Riscaldamento, 100% Lana e Merino, Electro Block di Sicurezza, Lavabile, 3 Temperature, Risparmio Energetico, Made in Italy","0","80","0","0","1665718130.45854",NA
"287","B01LZDKK2F","Imetec Sensitive Maxi Scaldasonno Singolo, si Adatta ai Cambi di Temperatura, Tessuto Anallergico, Electro Block, 6 Temperature, 190 x 90 cm, Bianco","0","94.46","0","0","1665718152.84309",NA
"288","B01M109MOV","Imetec Sensitive Maxi Scaldasonno Singolo, si Adatta ai Cambi di Temperatura, Tessuto Anallergico, Electro Block, 6 Temperature, 190 x 90 cm, Bianco","0","94.46","0","0","1665718175.15833",NA
"289","B01L969ZHW","Imetec 16284 Scaldasonno Express Singolo, Tecnologia Express Rapido Riscaldamento, 100% Lana e Merino, Electro Block di Sicurezza, Lavabile, 3 Temperature, Risparmio Energetico, Made in Italy","0","80","0","0","1665718197.17912",NA
"290","B01L969YMS",NA,"0",NA,"0","0","1665718217.19016",NA
"291","B01M1Y6Y6K","Imetec 16283 Scaldasonno Express Matrimoniale, Tecnologia Express Rapido Riscaldamento, 50% Lana e Merino, Electro Block di Sicurezza, Lavabile, 3 Temperature, Risparmio Energetico, Made in Italy","0",NA,"0","0","1665718238.87201",NA
"292","B01LZ1UUI6",NA,"0",NA,"0","0","1665718259.01057",NA
"293","B01L969XYC","Imetec 16280 Scaldasonno Express Singolo, Tecnologia Express Rapido Riscaldamento, Tessuto Trapuntato, Electro Block di Sicurezza, Lavabile, 3 Temperature, Risparmio Energetico, Made in Italy","0","64.9","0","0","1665718281.38552",NA
"294","B01L96A09E","Imetec 16280 Scaldasonno Express Singolo, Tecnologia Express Rapido Riscaldamento, Tessuto Trapuntato, Electro Block di Sicurezza, Lavabile, 3 Temperature, Risparmio Energetico, Made in Italy","0","64.9","0","0","1665718303.65984",NA
"295","B01CNW2500","Imetec Relaxy Intellisense Remote Plaid Riscaldabile, Coperta Elettrica con Bluetooth, 180x140 cm","0","30.99","0","0","1665718325.55796",NA
"296","B01LZ1YB12","Imetec Relaxy Intellisense Plaid Riscaldabile, Coperta Elettrica con Tasca per Mani, 150x70 cm","0","66.99","0","0","1665718347.82097",NA
"297","B01CNW257I","Imetec 16242 Scaldasonno Sensitive Singolo 150x80 cm, Tecnologia Remote, Tessuto Trapuntato, 6 Temperature, Timer di Autospegnimento, Lavabile in Lavatrice, Electro Block di Sicurezza","0","98.59","0","0","1665718369.95776",NA
"298","B01CNW24R4","Imetec 16242 Scaldasonno Sensitive Singolo 150x80 cm, Tecnologia Remote, Tessuto Trapuntato, 6 Temperature, Timer di Autospegnimento, Lavabile in Lavatrice, Electro Block di Sicurezza","0","98.59","0","0","1665718391.99308",NA
"299","B017X6MUVU","SGR Scaldaletto, Peluche 50% Lana, Matrimoniale","0","94.99","0","0","1665718413.67203",NA
"300","B017LHJZVY","SGR Scaldaletto, Peluche 50% Lana, Singolo","0","80","0","0","1665718435.96844",NA
"301","B00M975Z7K","Imetec 16176A Scaldasonno Sensitive Matrimoniale, si Adatta ai Cambi di Temperatura, Morbido Peluche, Coprimaterasso Maxi 190 x 160, Electro Block, 6 Temperature, Timer, Risparmio Energetico, Lavabile","0","144.99","0","0","1665718458.32117",NA
"302","B00NGKX45Y","Imetec Intellisense HP 03 Termoforo Renale, Comando digitale con 5 temperature, Tessuto in microfibra anallergico, Lavabile, 55 x 30 cm","0","37.99","0","0","1665718480.49754",NA
"303","B00NGKX6I4","Imetec BW 02 Boule Elettrica con Tecnologia Ceramica","0","36.99","0","0","1665718502.58522",NA
"304","B00KG1ZT1I","Imetec Intellisense Plaid Riscaldabile Matrimoniale 120 x 160 cm, Termocoperta con Tecnologia Intellisense, Morbida Ecopelliccia, Lavabile in Lavatrice","0","66.99","0","0","1665718525.00406",NA
"305","B00FGRPS6I","Imetec Intellisense CHP 03 Termoforo Cervicale e Spalle Extralarge, Comando digitale con 5 temperature, Tessuto in microfibra anallergico, Lavabile, 60 x 58 cm","0","47.99","0","0","1665718547.18056",NA
"306","B00E4KJ8HI","Imetec Intellisense SHP 01 Termoforo Multifunzione a Sabbia","0","40.29","0","0","1665718568.74459",NA
"307","B008OFBMW8","Imetec 16037 Scaldasonno Sensitive, 100% Lana e Merino, Scaldaletto Matrimoniale","0","144.99","0","0","1665718590.78322",NA
"308","B008OFBMI2","Imetec 16036 Scaldasonno Sensitive, 100% Lana e Merino, Scaldaletto Singolo","0",NA,"0","0","1665718612.55814",NA
"309","B008OFBM9Q","Imetec Intellisense FW 01 Scaldapiedi, Comando digitale a 5 temperature, Tessuto interno in microplush anallergico sfoderabile e traspirante, Lavabile","0","35.65","0","0","1665718634.6237",NA
"310","B00791DPI2","Imetec 6998 Scaldasonno Green Matrimoniale, Tessuto Riciclato al 100%, 9 Temperature, Timer di Autospegnimento, Lavabile in Lavatrice, Electro Block di Sicurezza","0",NA,"0","0","1665718656.41137",NA
"311","B005TVN99Y","Imetec Softly Scaldaletto, 50% Lana, Matrimoniale","0","87.9","0","0","1665718678.14285",NA
"312","B07Y8GR1WS",NA,"0",NA,"0","0","1665718698.17005",NA
"313","B07Y8GH4K8","Imetec Scaldasonno Adapto Matrimoniale 150 x 160 cm, Tecnologia Brevettata, Riscaldamento Rapido, Temperatura Costante e Personalizzata, 100% Cotone, 2 Comandi con 6 Temperature","0","149.99","0","0","1665718720.82463",NA
"314","B07Y8FDGDQ","Imetec Scaldasonno Adapto Piazza e Mezza 150 X 120 cm, Tecnologia Brevettata, Riscaldamento Rapido, Temperatura Costante e Personalizzata, 100 % Cotone, Comando con 6 Temperature","0","110.99","0","0","1665718743.12199",NA
"315","B07Y8GQMP5","Imetec Scaldasonno Adapto Singolo 150 x 80 Cm, Riscaldamento Rapido, Temperatura Costante e Personalizzata, 100% Lana e Merino, tessuto antiscivolo, Comando con 6 Temperature","0","80","0","0","1665718765.45119",NA
"316","B07Y8GCMLG",NA,"0",NA,"0","0","1665718785.59569",NA
"317","B07Y8FZ6GJ","Imetec Scaldasonno Adapto Singolo 150 x 80 cm, Riscaldamento Rapido, Temperatura Costante e Personalizzata, Tessuto Trapuntato Anallergico, Comando con 6 Temperature","0","84.9","0","0","1665718808.17053",NA
"318","B07Y8GQVND","Imetec Scaldasonno Adapto Matrimoniale, Riscaldamento Rapido, Temperatura Costante e Personalizzata, Tessuto Trapuntato Anallergico, Comando con 6 Temperature, 150 x 160 cm","0","159.9","0","0","1665718830.60961",NA
"319","B07Y8G9L1M","Imetec Adapto Velvet Tartan plaid riscaldabile 160x120 cm tessuto vellutato e setoso, Tecnologia Adapto, & Scaldasonno Adapto Singolo 150 x 80 cm, Riscaldamento Rapido","0","85","0","0","1665718852.98529",NA
"320","B00KKI8V58","Imetec Termoforo Cervicale, Comando Digitale con 5 Temperature, 42 x 38 cm","0","47.99","0","0","1665718874.62188",NA
"321","B00NOM9MK0","Imetec Relaxy Intellisense Hp-03 Termoforo Renale, Comando Digitale Con 5 Temperature, Beige, 40 x 25 x 25 cm","0","34.99","0","0","1665718896.30476",NA
"322","B00H2FTS90","Imetec Relaxy Intellisense Scalda-Materassi, Fibra Sintetica, Marrone, Matrimoniale","0",NA,"0","0","1665718917.98938",NA
"323","B00H2FTN9U","Imetec Relaxy Intellisense Scaldaletto Matrimoniale, Comando digitale con 6 temperature, Tessuto in microfibra anallergico, Lavabile, 150 x 137 cm","0","34.9","0","0","1665718940.27198",NA
"324","B01DU6GJLO","Imetec Relaxy Intellisense HP 04 Termoforo multifunzione, Comando digitale con 5 temperature, Tessuto in microfibra anallergico, Lavabile, 40 x 32 cm","0","40.29","0","0","1665718961.86922",NA
"325","B00F0HK0XA","Imetec Relaxy Intellisense CHP 02 Termoforo Cervicale, Comando Digitale con 5 Temperature con Riscaldamento Rapido, Tessuto in Microfibra Anallergico, Lavabile, Dimensioni XXL 52 x 38 cm","0","47.99","0","0","1665718983.97627",NA
"326","B00BTVSROU","Imetec HP-01, Termoforo Multifunzione, Comando Digitale con 5 Temperature, Marrone/Rosso, 40 x 35 cm","0","34.99","0","0","1665719005.80231",NA
"327","B00GAX0F1U","Imetec HP-01, Termoforo Multifunzione, Comando Digitale con 5 Temperature, Marrone/Rosso, 40 x 35 cm","0","34.99","0","0","1665719027.85683",NA
"328","B00GOWKD82","Imetec Relaxy Scaldaletto Singolo, Comando 2 temperature, Tessuto in polyestere, Lavabile a mano e in lavatrice a 40°, 150 x 70 cm","0","36.99","0","0","1665719049.84904",NA
"329","B00A9269R2","Imetec Scaldaletto Singolo, Comando 2 Temperature, Tessuto Trapuntato, Lavabile a Mano e in Lavatrice a 40° C, 150 x 80 cm","0","64.9","0","0","1665719072.417",NA
"330","B00K6MR6JK","Imetec Scaldaletto Matrimoniale, 2 Comandi con 2 Temperature, Tessuto Trapuntato, Lavabile a Mano e in Lavatrice a 40° C, 150 x 140 cm","0","94.99","0","0","1665719095.03436",NA
"331","B00BTVSK8I","Imetec Relaxy FW 01 Intellisense Scaldapiedi, Fibra Sintetica, Marrone/Rosso, Ad Una Piazza","0","35.65","0","0","1665719116.85598",NA
"332","B004ASNGB8",NA,"0",NA,"0","0","1665719136.98459",NA
"333","B004ASNGBI","Imetec SM3-200 Sensuij Sedile Massaggiante","0","81.69","0","0","1665719159.03723",NA
"334","B004ASNGEA",NA,"0",NA,"0","0","1665719179.09548",NA
"335","B00FZN1H4U","Imetec NS 100 Doccia Nasale Rinowash Micronizzata, Adatto a Tutte Le Età","0","18.9","0","0","1665719201.61298",NA
"336","B00FMUJMBG","Imetec MP3-200 Idromassaggiatore Plantare","0","60.15","0","0","1665719223.77098",NA
"337","B00AKFUBLI","Imetec BP2 200 Provapressione da Braccio","0","29.99","0","0","1665719245.45524",NA
"338","B00BBUWQR8","Imetec MED BP1 100 Provapressione da Polso","0","32.99","0","0","1665719267.45735",NA
"339","B00AZIV8HG","Imetec MED BP1 200 Provapressione da Braccio, bianco","0",NA,"0","0","1665719288.75355",NA
"340","B00G3NJVLC","Imetec Med AR 400 Aerosol, 230 V, Bianco","0","39.99","0","0","1665719311.03986",NA
"341","B00AKFUB9K","Imetec MED BP2 100 Provapressione da Polso a Lettura Agevolata","0","29.99","0","0","1665719332.92694",NA
"342","B00AKFUC9E",NA,"0",NA,"0","0","1665719352.94906",NA
"343","B00N1TYH88","Imetec Med AR 500 Aerosol, 230 V, Bianco","0","39.99","0","0","1665719374.87417",NA
"344","B00FZUMBCK","Imetec MED TD1 100 Termometro Digitale","0",NA,"0","0","1665719396.28803",NA
"345","B075BMSMRF","Imetec Med AR1000 Aerosol a Pistone con Mascherina Pediatrica a Grandezza Variabile e Snodo per Somministrare i Farmaci in Posizione Sdraiata, Completo di Accessori, Dispositivo Medico CE0434","0",NA,"0","0","1665719418.18758",NA
"346","B00KIDANX8","Imetec BS5 500 Bilancia Pesapersone Elettronica, azzuro, lcd","0","26.99","0","0","1665719440.36338",NA
"347","B00KMU8XFC",NA,"0",NA,"0","0","1665719460.44596",NA
"348","B00KIRP6LS","Imetec BS4 500 Pesapersone Elettronica, Display LCD, Indicatore Batteria, Verde","0","22.9","0","0","1665719482.34148",NA
"349","B00KMU8XCU","Imetec BM3 300 Bilancia Pesapersone Elettronica, Calcola l'indice di massa corporea, beige, lcd","0","27.9","0","0","1665719504.63953",NA
"350","B0050IIHAM","Imetec Medical Pro, Pesapersone Meccanica, Ampio Quadrante ad Alta Visibilità, Pedana Antiscivolo, Portata Max 180 Kg, Divisione 1 kg, Scocca Metallo Cromato","0","56.2","0","0","1665719527.11861",NA
"351","B0050IIE5A","Imetec ECO SB1 100 Pesapersone Elettronica","0",NA,"0","0","1665719548.56365",NA
"352","B0052WYN1S","Imetec BS3 300 Pesapersone Elettronica","0","31","0","0","1665719570.41607",NA
"353","B0052WYO08","Imetec BF2 200 Pesapersone Elettronica","0","16.9","0","0","1665719591.87278",NA
"354","B0063RMI6S","Imetec BF4 400 Pesapersone Elettronica","0",NA,"0","0","1665719613.47598",NA
"355","B07VGH4Z81","Imetec Body Analizer ES7 400 Bilancia Pesapersone Diagnostica, Misura Acqua Corporea, Massa Muscolare e Grassa","0","26.99","0","0","1665719635.56303",NA
"356","B07VC16GW8","Imetec Compact ES1 100 Bilancia pesapersone elettronica compatta, Design ultrasottile, Ampio LCD display, Portata Max 150 kg","0","16.9","0","0","1665719657.72407",NA
"357","B07W4JVN8S",NA,"0",NA,"0","0","1665719677.76083",NA
"358","B07WBZC85N","Imetec Precision ES13 200 Bilancia pesapersone elettronica, rivela anche le minime variazioni di peso, fino a 180 Kg, LCD Display, vetro temperato, batterie incluse","0","26.99","0","0","1665719699.8356",NA
"359","B00LJF1UZY","Imetec Piuma Force Scopa Elettrica, Senza Sacco, Classe A","0","101.51","0","0","1665719721.53309",NA
"360","B00LJF1U22","Imetec Piuma Scopa Elettrica, Senza Sacco, Classe A","0","84","0","0","1665719743.59463",NA
"361","B00NAVVX6Q","Imetec Start&Stop Scopa Elettrica, senza Sacco, Tecnologia Ciclonica, Accensione e Spegnimento Automatici, Tecnologia a Rismarmio Energetico, Regolazione Elettronica della Potenza","0","284.24","0","0","1665719765.80737",NA
"362","B015WNP748","Imetec Piuma Scopa Elettrica, Tecnologia con Sacco, Classe A","0",NA,"0","0","1665719787.59187",NA
"363","B00NAVVZ3M","Imetec SuperPlate Compact Lucidatrice Compatta, 4 Set di Spazzole, Calotta Bassa, Manico Telescopico Allungabile, Lucida il Parquet","0","209","0","0","1665719810.00029",NA
"364","B00NAQ0VSM","Imetec Eco Extreme Silence Aspirapolvere","0",NA,"0","0","1665719831.75937",NA
"365","B00MW2WKDE","Imetec Max Power Scopa Elettrica, senza Sacco, Tecnologia Ciclonica, Avvolgifilo Automatico, Tecnologia a Rismarmio Energetico, Regolazione Elettronica della Potenza","0","47.87","0","0","1665719853.21428",NA
"366","B01BGRZXKM","Imetec Master Vepor Detrgent Plus SM04, Scopa Lavpavimenti a Vepore, Funzionaento più Detergente, Vapore a 120°C, 12 Accessori, Generatore di Vepore Poratile, 3 Panni in Microfibra","0","55.8","0","0","1665719875.37354",NA
"367","B012DHYAOO",NA,"0",NA,"0","0","1665719895.42719",NA
"368","B015OEJTYY","Imetec Max Power Animal Care Scopa Elettrica, senza Sacco, Avvolgifilo Automatico, Turbospazzola Animal Care, Regolazione Elettronica della Potenza","0",NA,"0","0","1665719916.95356",NA
"369","B00OQ38BNU","Imetec Duetta Cordless 2 in 1 Scopa Elettrica, Ricaricabile, 18 V, senza Fili, Leggera, Tecnologia Ciclonica, Miniaspirapolvere Incorporato, Autonomia 30'","0","99.99","0","0","1665719938.9181",NA
"370","B015WNP752","Imetec Piuma Force Cordless Scopa Elettrica Senza Fili, 32 V, Leggera e Maneggevole, Tecnologia Ciclonica, Spazzola Multisuperficie","0","225.33","0","0","1665719960.63379",NA
"371","B015WNP79I",NA,"0",NA,"0","0","1665719980.62872",NA
"372","B00NAVW2DE","Imetec Eco Extreme Silence Aspirapolvere","0",NA,"0","0","1665720002.3908",NA
"373","B00J8LWXH0","Imetec Ecovacs Winbot W710 Robot per Pulizia Automatica di Vetri e Finestre","0","22.99","0","0","1665720024.54309",NA
"374","B00J9A8RNE","Imetec 8137 Master Vapor SM01 Pulitore a Vapore + 3 panni in microfibra di ricambio","0","85.99","0","0","1665720046.65025",NA
"375","B01BGRZXIY",NA,"0",NA,"0","0","1665720066.64684",NA
"376","B0158R6S5K","Imetec Master Plus SM02 Scopa Lavapavimenti 120°C, 10 Accessori, Generatore di Portatile, Pronto in Pochi Secondi, 2 Panni in Microfibra","0","97","0","0","1665720089.24222",NA
"377","B00NQ4LDY4",NA,"0",NA,"0","0","1665720109.23288",NA
"378","B01LY2TWKN","Imetec Max Power Scopa Elettrica, senza Sacco, Tecnologia Ciclonica, Avvolgifilo Automatico, Tecnologia a Rismarmio Energetico, Regolazione Elettronica della Potenza","0","47.87","0","0","1665720131.48182",NA
"379","B01M19HDRM","Imetec Eco Extreme Animal Care Aspirapolvere","0","9.9","0","0","1665720153.71173",NA
"380","B01LZLVGIB","Imetec Piuma Cordless Scopa Elettrica, Ricaricabile, 18.5 V, senza Fili, Leggera, Tecnologia Ciclonica, Autonomia 35', Spazzola Multisuperficie","0","84","0","0","1665720175.99548",NA
"381","B00J911OZQ",NA,"0",NA,"0","0","1665720196.13865",NA
"382","B015WNPB08","Imetec Piuma Force Cordless Scopa Elettrica Senza Fili, 25 V, Leggera e Maneggevole, Tecnologia Ciclonica, Spazzola Multisuperficie","0","152.59","0","0","1665720218.45032",NA
"383","B074TNT7Y7","Imetec Piuma Force++ S2-100 Scopa elettrica con Sacco, Leggera, Tecnologia a Risparmio energetico, Spazzola multisuperficie","0","122.45","0","0","1665720240.3179",NA
"384","B074TMX9J3","Imetec 8634 Piuma+ C2-100 Scopa Elettrica Senza Sacco, Classe A+, Leggera, Riduzione del Consumo Energetico, 76 Decibel, Plastica, Bianco/Verde","0",NA,"0","0","1665720262.30508",NA
"385","B074TNW3L4","Imetec Piuma+ C2-200 Scopa Elettrica, Aspirapolvere con Tecnologia Ciclonica Senza Sacco, Regolazione Elettronica della Potenza, Leggera 3 kg, Filtro Hepa Ipoallergenico, Bianco/Viola","0",NA,"0","0","1665720284.19417",NA
"386","B074TNT7YD","Imetec EcoExtreme PRO C2-200 Aspirapolvere Senza Sacco, Turbospazzola Animal Care, Tecnologia ciclonica senza sacchetto, Tecnologia a risparmio energetico, Spazzola parquet","0","129.9","0","0","1665720306.64426",NA
"387","B074TMNTQK","Imetec 8632 Ecoextreme PRO++ C2-100 Aspirapolvere Senza Sacco, Classe Energetica A++ con Spazzola Parquet","0","129.98","0","0","1665720328.8751",NA
"388","B074TMJN25","Imetec 8078 Duetta++ C5-300 Scopa Elettrica 2 in 1 con Miniaspirapolvere Integrato e Tecnologia Ciclonica","0","102.63","0","0","1665720350.89759",NA
"389","B076G1RLQX","Imetec 8074 Scopa Elettrica Senza Filo-Turbospazzola e Autonomia, Grigio","0","49","0","0","1665720373.27481",NA
"390","B075ZRP3CS","Imetec Piuma Force++ C2-400 Scopa Elettrica Senza Sacco, Leggera, Tecnologia Ciclonica, Filtro Hepa, Spazzola Parquet, Regolazione Elettronica della Potenza","0","84","0","0","1665720395.35185",NA
"391","B075ZPXS6V","TP-Link 8180 Imetec Piuma Force++ C2-300 Scopa Elettrica Senza Sacco, Leggera, Classe A++, Tecnologia Ciclonica, Filtro Hepa Ipoallergenico, Bianco/Arancione","0","84","0","0","1665720417.4382",NA
"392","B077GZ81KQ","Imetec 3X Pro Aspirapolvere Senza Filo e Sacco, Motore Digitale, a Stelo, Miniaspirapolvere, Autonomia Fino A 35’, Turbospazzola Automatica, Animal Care, 7 Accessori","0","135.49","0","0","1665720439.4807",NA
"393","B07J3SF9X8","Imetec Extreme Filtration + 8175, Aspirapolvere Senza Sacco, Compatto, Doppio Filtro Hepa Ipoallergenico, Spazzola per Parquet, Tecnologia Ciclonica, Potenza Regolabile","0","72.19","0","0","1665720461.26185",NA
"394","B07W5FS4ZL",NA,"0",NA,"0","0","1665720481.30631",NA
"395","B07W49FGYS","Imetec Piuma Extreme++ SC3-600 Aspirapolvere con Tecnologia Ciclonica Senza Sacco, Regolazione Elettronica della Potenza, Leggera 4 kg, Spazzola multisuperficie e Parquet, Multiaccessoriata","0","135.49","0","0","1665720503.98893",NA
"396","B0059GLZUY","Imetec Iron Max Eco Professional 2700 Ferro da Stiro con Caldaia in Pressione, Piastra in Acciaio Inossiadabile, Generatore di Vapore, Manometro per il Controllo della Pressione","0","109.99","0","0","1665720525.63798",NA
"397","B0059GM0GW","Imetec Iron Max Eco Professional 2500 Ferro da Stiro con Caldaia in Pressione, Piastra in Acciaio Inossiadabile, Generatore di Vapore","0","109.99","0","0","1665720547.63271",NA
"398","B00ABL17A0",NA,"0",NA,"0","0","1665720567.79507",NA
"399","B00FGRYBT8","Imetec Intellivapor Eco Ferro da Stiro con Caldaia, Tecnologia Intellivapor, Pressione Vapore 5 BAR, Piastra Acciaio Inox, Tecnologia a Risparmio Energetico","0","99.9","0","0","1665720589.9754",NA
"400","B009E3VNAK","Imetec NoStop Eco Professional Ferro con Caldaia in Pressione, Piastra in Acciaio Inossidabile e Generatore di Vapore da 5 bar, Tecnologia a Risparmio Energetico, Tecnologia NoStop","0","158","0","0","1665720611.97568",NA
"401","B00FGRYW7O","Imetec Titanox Eco K112 Ferro da Stiro a Vapore, Piastra in Acciaio Inox","0","9.9","0","0","1665720634.71557",NA
"402","B00GLSDCS2","Imetec Nuvola Ferro da Stiro da Viaggio a Vapore, Piastra in Acciaio Inossidabile da 1000 W, Custodia da Viaggio, Doppio Voltaggio","0","22.99","0","0","1665720657.12886",NA
"403","B005U1WNWC","Imetec Zerocalc Eco Professional 2400 Ferro da Stiro a Vapore, Piastra in Acciaio Inox","0","49.9","0","0","1665720678.92804",NA
"404","B00O3X8VZG","Imetec Titanox Eco K116 Ferro da Stiro a Vapore, Piastra in Acciaio Inox","0","30.9","0","0","1665720700.44998",NA
"405","B00TDNGVX0","Imetec Titanox Eco K114 Ferro da Stiro a Vapore, Piastra in Acciaio Inox","0","21.99","0","0","1665720722.74454",NA
"406","B015WNPAYK","Imetec Intellivapor Prestige Ferro da Stiro Generatore di Vapore, Tecnologia Intellivapor, 4.5 BAR Pump, Colpo Vapore 200 G, Tecnologia a Risparmio Energetico, Tecnologia NoStop","0","128.85","0","0","1665720744.63862",NA
"407","B01BGRZY10","Imetec Intellivapor Professional Ferro da Stiro, Generatore di Vapore, Tecnologia Intellivapor, 4.8 bar Pressione alla Pompa, Colpo Vapore 230 g, Tecnologia a Risparmio Energetico, Tecnologia NoStop","0","85.98","0","0","1665720766.31589",NA
"408","B011DHJIRE","Imetec Zerocalc Eco K4 2400 Ferro da Stiro, Bianco","0",NA,"0","0","1665720788.2159",NA
"409","B0050IJ3V4","Imetec Titanox K109 Ferro da Stiro a Vapore, Piastra in Acciaio Inox","0","30.9","0","0","1665720810.43352",NA
"410","B0050IJ8J6",NA,"0",NA,"0","0","1665720830.48967",NA
"411","B01EYQUL2M","Imetec Titanox K113 Ferro da Stiro a Vapore, Piastra in Acciaio Inossidabile 2100 W, Leggero e Maneggevole, Colpo Vapore 90 g, Vapore Regolabile","0","16.99","0","0","1665720853.33378",NA
"412","B01EO697BI","Imetec Titanox K109 Ferro Da Stiro A Vapore, Piastra In Acciaio Inossidabile Multiforo Da 2000 W, Bianco Blu","0","16.99","0","0","1665720875.60666",NA
"413","B01LZXN3WK","Imetec Intellivapor Expert IM2500 Ferro con Caldaia ad Alta pressione, Tecnologia Intellivapor, Tecnologia a Risparmio Energetico, Piastra e Caldaia in Acciaio Inossidabile","0","109.99","0","0","1665720897.43644",NA
"414","B01LX03UPH","Imetec Intellivapor Expert IM2500 Ferro con Caldaia ad Alta pressione, Tecnologia Intellivapor, Tecnologia a Risparmio Energetico, Piastra e Caldaia in Acciaio Inossidabile","0","109.99","0","0","1665720919.10894",NA
"415","B01LYMRVA3","Imetec Zerocalc Pro 2300 Ferro da Stiro a Vapore ad Alte Prestazioni, Piastra in Acciaio Inossidabile da 2300 W, Tecnologia Anticalcare, Tecnologia a Risparmio Energetico","0","55","0","0","1665720940.74576",NA
"416","B01LZA1IHE","Imetec Intellivapor K1 Ferro da Stiro a Vapore, Tecnologia Intellivapor, Piastra in Acciaio Inossidabile da 2300 W, Tecnologia a Risparmio Energetico","0","35.19","0","0","1665720962.57629",NA
"417","B01M09BNCN","Imetec Intellivapor K3 Ferro da Stiro a Vapore, Tecnologia Intellivapor, Piastra in Acciaio Inossidabile da 2300 W, Tecnologia a Risparmio Energetico","0","35.19","0","0","1665720984.35062",NA
"418","B01LY802Z9","Imetec Intellivapor K5 Ferro da Stiro a Vapore, Tecnologia Intellivapor, Piastra in Acciaio Inossidabile da 2400 W, Tecnologia a Risparmio Energetico","0","35.19","0","0","1665721006.39868",NA
"419","B01M0KZ2PI","Imetec Zerocalc Pro 2200 Ferro da Stiro a Vapore ad Alte Prestazioni, Piastra in Acciaio Inossidabile da 2200 W, Tecnologia Anticalcare, Tecnologia a Risparmio Energetico","0","33.44","0","0","1665721028.52033",NA
