"","asin","product_name","sku","price_cleaning","native_price","discount_percentage","date","X..i.."
"1","B006JYFNUI","Imetec Acqua Bottiglia di Ricambio per Imetec Acqua Bubbles BLS 100 - BLS 110","0",NA,"0","0","1665579747.72688",NA
"2","B00TDNGW3Y","Imetec Acqua The Bottle BT 300 Bottiglia di Ricambio per Imetec Acqua The Bottle FB 110 e FB 100","0","15","0","0","1665579769.77552",NA
"3","B008DREKCQ","Imetec H2O Flux Technology, 3 Cartucce Filtranti per Prodotti Acqua, Ricambi Originali","0","20.1","0","0","1665579791.94622",NA
"4","B008DREU30","Imetec Acqua WP120 Caraffa Filtrante con 3 Filtri FC100 Inclusi","0","20.1","0","0","1665579814.06377",NA
"5","B00GAY1TYG","Imetec Acqua The Bottle FB 100 Bottiglia Filtrante","0","36.9","0","0","1665579836.30624",NA
"6","B00GM9FVRU","Imetec Acqua The Bottle FB 120 Bottiglia Filtrante, Family Pack","0","15","0","0","1665579858.31183",NA
"7","B006JNA2OG","Imetec BLS100 Gasatore d'Acqua con 3 Livelli di Gasatura, Bottiglia con Tappo di Chiusura da 1 Litro, Cilindro per Gasare Fino a 80 Litri Incluso, Nero, Ceramica, 0","0",NA,"0","0","1665579880.20661",NA
"8","B0069ORHTS","Imetec 7744J BLS110 Gasatore d'Acqua con 3 Livelli di Gasatura, Bottiglia con Tappo di Chiusura da 1 Litro, Cilindro per Gasare Fino a 80 Litri Incluso, Nero, Arancione","0",NA,"0","0","1665579902.34951",NA
"9","B006JN451C","Imetec 7730 Cilindro Universale per Gasatori Domestici, Co2 Proveniente da Fonti Naturali, Gasa Fino a 80 Litri di Acqua, Blue","0","20.1","0","0","1665579924.52304",NA
"10","B00XMY1XVQ","IMETEC The Drinking Station WS100 Apparecchio per la Depurazione e la Gasatura Rubinetto, 120 l Depurata e Fino a 80 l di Acqua Gasata, Plastic","0",NA,"0","0","1665579945.88425",NA
"11","B00MHUG8LG","Imetec Acqua The Bottle FB 100 Bottiglia Filtrante","0","36.9","0","0","1665579967.87451",NA
"12","B007X31N7Q","Imetec Bellissima Magic Style PB1 45 Spazzola Professionale Riscaldata","0","34.9","0","0","1665579990.38315",NA
"13","B007YH05SO","Imetec Bellissima Magic Style PB1 30 Spazzola Professionale Riscaldata","0",NA,"0","0","1665580012.55602",NA
"14","B00G3NJTWS","Imetec Bellissima Magic Style PB4 30 Spazzola Professionale Riscaldata, Diametro 30 mm, Rivestimento in Ceramica, Regolazione della Temperatura, Sistema Anti Efetto Crespo, Guida Styling Inclusa","0",NA,"0","0","1665580035.06689",NA
"15","B00G3NJSC4","Imetec Bellissima Magic Style PB4 38 Spazzola Professionale Riscaldata, Diametro 38 mm, Rivestimento in Ceramica, Regolazione della Temperatura, Sistema Anti Efetto Crespo, Guida Styling Inclusa","0","34.9","0","0","1665580057.37042",NA
"16","B00EFP7L3K","Imetec Bellissima Magic Style PB1 25 Spazzola Professionale Riscaldata, Diametro 25 mm, Rivestimento in Ceramica, Sistema Anti Efetto Crespo, Guida Styling Inclusa","0","34.9","0","0","1665580079.9116",NA
"17","B00FGRYLHA","Imetec Bellissima Magic Style PB1 30 Spazzola Professionale Riscaldata, Diametro 30 mm, Rivestimento in Ceramica, Regolazione della Temperatura, Sistema Anti Efetto Crespo, Guida Styling Inclusa","0","10.9","0","0","1665580101.97885",NA
"18","B00M0K1VYM","Imetec Bellissima Magic Style PB1 38 Spazzola Professionale Riscaldata, Diametro 38 mm, Rivestimento in Ceramica, Sistema Anti Efetto Crespo, Guida Styling Inclusa","0","34.9","0","0","1665580123.8956",NA
"19","B00FXBCNP6","Imetec Bellissima Magic Style PB1 45 Spazzola Professionale Riscaldata, Diametro 45 mm, Rivestimento in Ceramica, Sistema Anti Efetto Crespo, Guida Styling Inclusa","0","49.99","0","0","1665580145.8956",NA
"20","B00DZK6CJK","Imetec Bellissima Magic Style PB2 25 Spazzola Professionale Riscaldata, Diametro 25 mm, Rivestimento in Gloss Titanium Ceramic, Sistema Anti Efetto Crespo, Guida Styling Inclusa","0","34.9","0","0","1665580167.65107",NA
"21","B00FHQJ44U","Imetec Bellissima Magic Style PB2 30 Spazzola Professionale Riscaldata, Diametro 30 mm, Rivestimento in Ceramica, Sistema Anti Efetto Crespo, Guida Styling Inclusa","0",NA,"0","0","1665580189.097",NA
"22","B00FHQJ0TE","Imetec Bellissima Magic Style PB2 38 Spazzola Professionale Riscaldata, Diametro 38 mm, Rivestimento in Gloss Titanium Ceramic, Tecnologia a Ioni, Sistema Anti Efetto Crespo, Guida Styling Inclusa","0","29.12","0","0","1665580211.36142",NA
"23","B00FR5XS8Y","Imetec Bellissima Magic Style PB2 45 Spazzola Professionale Riscaldata, Diametro 45 mm, Rivestimento in Gloss Titanium Ceramic, Tecnologia a Ioni, Sistema Anti Efetto Crespo, Guida Styling Inclusa","0","33.99","0","0","1665580233.55003",NA
"24","B002YY6M0C","Imetec Bellissima Mini MC210 Piastra per Capelli","0","26.39","0","0","1665580255.6022",NA
"25","B013GDSCRK","Bellissima Imetec BHS3 100 Revolution, Arricciacapelli Automatico, Rivestimento in Ceramica, Viola Nero","0","57.88","0","0","1665580277.8463",NA
"26","B00NTYWDNQ","Bellissima Imetec Revolution BHD1 1000 Asciugacapelli Professionale, 1400 W, con Prestazioni da 2000 W, Tecnologia a Ioni, Sistema Eco Efficiency, 8 Combinazioni Aria/Temperatura","0","28.9","0","0","1665580299.753",NA
"27","B0089LSRZW","Imetec Bellissima Magic Style PB2 30, Spazzola Professionale Riscaldata, Rivestimento in Gloss Titanium Ceramic, Tecnologia agli Ioni, Diametro 30 mm","0","27.5","0","0","1665580322.03491",NA
"28","B004ASNGKE","Imetec Bellissima Absolute BA 230 Piastra per Capelli con Ttecnologia a Infrarossi, Capelli Liscio Duraturo, Thermo Control, Display LCD, Custodia Termoprotettiva Inclusa","0","62.99","0","0","1665580344.11504",NA
"29","B00CEH0LTW","Imetec Travel Ct1 2000 Asciugacapelli Da Viaggio, 1400 W, Doppio Voltaggio, Nero Grigio","0","18.99","0","0","1665580366.69848",NA
"30","B009E7CGTI","Bellissima Imetec B 100 Piastra per Capelli, Effetto Liscio, Rivestimento in Ceramica, Regolazione della Temperatura da 150°C a 230°C, Sistema di Riscaldamento Rapido, Pronto all'Uso","0","32.99","0","0","1665580388.9287",NA
"31","B006UFWP3E","Bellissima Imetec Diffon DF1 1000 Diffusore ad Aria Calda per Capelli Ricci, 700 W, 2 Combinazioni Aria/Temperatura, Asciugatura Delicata, Ricci Composti Senza Effetto Crespo","0","35.99","0","0","1665580411.50856",NA
"32","B00VRGPXF8","Bellissima Imetec GT15 100 Arricciacapelli, Ricci Brillanti e Definiti, Diametro 19 mm, Rivestimento in Ceramica, Riscaldamento Rapido, Pronto all'Uso","0","25.99","0","0","1665580434.05793",NA
"33","B015O6A6GC","Imetec Bellissima GT15 300 Ferro Arricciacapelli con Rivestimento in Ceramica, Sistema di riscaldamento rapido, Controllo della Temperatura","0","20.4","0","0","1665580455.62799",NA
"34","B00IZXY762","Imetec Bellissima Style Creator B6 200 Piastra per Capelli, 4 Cover per 4 Styling Diversi, Piastre Esterne Riscaldate per uno Risultato Definito e Duraturo, Rivestimento in Nano-ceramica e Tormalina","0","47.23","0","0","1665580477.69781",NA
"35","B015O6AB4E","Imetec Salon Expert P1 2300 Asciugacapelli Professionale, 2300 W, Tecnologia a Ioni, Rivestimento Griglia in Ceramica e Tormalina, 8 Combinazioni Aria/Temperatura, Diffusore Professionale","0",NA,"0","0","1665580499.45846",NA
"36","B009KM58JC","Imetec Salon Expert P1 2000 Asciugacapelli Professionale","0",NA,"0","0","1665580521.54023",NA
"37","B0063RMBL0","Imetec Salon Expert P8 2000 Asciugacapelli Professionale, 2000 W, 8 Combinazioni Aria/Temperatura, Beccuccio Stretto","0",NA,"0","0","1665580543.47273",NA
"38","B00AE6HEK4","Imetec Bellissima Creativity B1 700 Piastra per Capelli, Thermo Control 150° - 230°, Piastre Arrotondate per uno Styling Liscio o Mosso","0","32.99","0","0","1665580564.95257",NA
"39","B015O6AFUO","Imetec Power To Style C19 2000 Asciugacapelli, 2000 W, Beccuccio Direzionabile, Design Compatto, Asciugatura Rapida, 2 Combinazioni Aria/Temperatura","0","23.9","0","0","1665580586.64188",NA
"40","B00SKVYAVG","Imetec Salon Expert GT16 100 Arricciacapelli","0","19.9","0","0","1665580609.14679",NA
"41","B015O6AFPE","Imetec C20 2100 Asciugacapelli, 2100 W, Beccuccio Orientabile, Diffusore Professionale, Funzione Fast Drying per un'Asciugatura Rapida, 4 Combinazioni Aria/Temperatura, Colpo Aria Fredda, Cavo 1.8 m","0","21.75","0","0","1665580631.16325",NA
"42","B015O6A6IA","Imetec Bellissima GH18 800 Spazzola ad Aria Modellante per capelli con 3 Accessori di Styling, Potenza 800 W, 2 Combinazioni Flussi d'Aria/Temperatura, Colpo d'Aria Fredda, Puntale Antiscottatura","0","33.99","0","0","1665580653.06081",NA
"43","B00SKVYB6K","Bellissima Imetec GT13 50 Arricciacapelli, Rivestimento in Ceramica, 7 Diversi Livelli di Temperatura da 150°C a 210°C, Diametro di 25 mm, Riscaldamento Rapido, Pronto all'Uso","0","25.99","0","0","1665580675.54664",NA
"44","B0158FP4I4","Bellissima Imetec Revolution BHD2 2000 Asciugacapelli Professionale con Rotazione Automatica, 2000 W, 8 Combinazioni Aria/Temperatura, Tecnologia a Ioni, Diffusore capelli ricci","0","39.99","0","0","1665580697.8873",NA
"45","B01411FWBK","Imetec Travel Ct1 2000 Asciugacapelli Da Viaggio, 1400 W, Doppio Voltaggio, Nero Grigio","0","18.99","0","0","1665580720.1657",NA
"46","B015O6AAVI","Imetec Bellissima Anniversary BA1 100 Piastra per Capelli Lisci in una Sola Passata, Regolazione della Temperatura da 160°C a 230°C, Rivestimento in Ceramica, Sistema di Riscaldamento Rapido","0",NA,"0","0","1665580742.74002",NA
"47","B015O6ABLW","Imetec Salon Expert P2 2200 Asciugacapelli Professionale, Motore AC 2200 W, Tecnologia a Ioni, Rivestimento in Ceramica e Tormalina, Diffusore Professionale a Dita, Convogliatore Stretto, Nero","0","29.99","0","0","1665580765.0559",NA
"48","B015O6A68K","Bellissima Imetec Creativity B9 400 Piastra per Capelli, Styling Liscio o Mosso, Rivestimento in Ceramica e Cheratina, Piastre Arrotondate","0","36","0","0","1665580787.41666",NA
"49","B015O6ABKS","Imetec Ultra PC6 2000 Asciugacapelli Professionale con Tecnologia Doppia Turbina, 3 Beccucci, Diffusore Professionale a Dita, Rivestimento Griglia In Ceramica e Tormalina","0","39.99","0","0","1665580809.6822",NA
"50","B015O6AFUE","Imetec Bellissima Anniversary Intellisense BA20 100 Piastra per Capelli","0","85.6","0","0","1665580832.32698",NA
"51","B015O6AB3U","Imetec Bellissima Anniversary BA3 700 Piastra per Capelli, Piastre Arrotondate Riscaldate per un Effetto Liscio Totale, Ricci Definiti o Onde Morbide, Rivestimento in Ceramica per Capelli Protetti","0",NA,"0","0","1665580854.54642",NA
"52","B015O6A6GM","Bellissima Imetec P11 2300 Asciugacapelli Professionale, 2300 W, Rivestimento in Ceramica e Tormalina, 8 Combinazioni Aria/Temperatura, Beccuccio Stretto, Diffusore capelli ricci","0","34.99","0","0","1665580877.29151",NA
"53","B015O6A6MG","Imetec Bellissima GH18 1000 Spazzola ad Aria Modellante con 5 Accessori di Styling, Potenza 1000 W, 2 Combinazioni Flusso d'Aria/Temperatura, Puntale Antiscottatura","0",NA,"0","0","1665580899.38502",NA
"54","B0162IJ6NU","Bellissima Imetec GT15 400 Arricciacapelli, Rivestimento in Ceramica e Keratina, 7 Diversi Livelli di Temperatura da 150°C a 210°C, Diametro 32 mm, Sistema di Riscaldamento Rapido Pronto all'Uso","0","25.99","0","0","1665580921.06568",NA
"55","B005FBTG18","Imetec Bellissima Multicurl S1 700 Arricciacapelli, Ricci Definiti a Lunga Durata, Sistema Easy Curl per Creare Ricci Subito, Rivestimento in Ceramica, 3 Livelli di Temperatura da 170°C a 210°C","0",NA,"0","0","1665580942.69029",NA
"56","B004ASNGLI","Imetec Salon Expert P4 2500 ION Asciugacapelli Professionale, Potenza 2000 W, Tecnologia a Ioni, Rivestimento in Ceramica e Tormalina, 8 Combinazioni Aria/Temperatura, Beccuccio Stretto","0","39.99","0","0","1665580965.10676",NA
"57","B00VYLJ4H4","Bellissima Imetec Creativity B9 300 Piastra per Capelli, Styling Liscio o Mosso, Rivestimento in Ceramica, Regolazione Temperatura da 150°C a 230°C, Sistema Riscaldamento Rapido","0","32.99","0","0","1665580987.127",NA
"58","B00KJ2GWY2","Imetec Power to Style C16 2000 Asciugacapelli da Viaggio, 2000 W, in Dimensioni Ridotte, Manico Pieghevole, Asciugatura Rapida, 3 Combinazioni Aria/Temperatura, Comodo da Portare in Viaggio","0","27.41","0","0","1665581009.23256",NA
"59","B00G3NJRWK","Imetec Bellissima Creativity B8 100 Piastra per Capelli con Tecnologia a Infrarossi , Capelli Liscio Assoluto o Mosso Definito, Rivestimento in Ceramica e Keratina, Display LCD","0",NA,"0","0","1665581031.30372",NA
"60","B00RP0J7AW","Bellissima Imetec B9 100 Piastra per Capelli, Piastra extralunghe, Riscaldamento Rapido, Multivoltaggio Automatico, Temperatura 210°, cavo giravole","0","32.9","0","0","1665581053.78035",NA
"61","B00NAVVTOW","Bellissima Imetec Revolution BHS2 100 Spazzola Rotante Modellante, Rotazione della Spazzola Regolabile, Setole in Silicone, Rivestimento in Ceramica e Keratina, 200°C, Diametro 32 mm","0","54.9","0","0","1665581076.04332",NA
"62","B0050IIALS","Imetec Salon Expert EC9 100 Piastra Professionale per Capelli, Styling Liscio o Mosso, Rivestimento in Ceramica, Piastre Arrotondate, Display LCD, Regolazione della Temperatura da 130°C a 230°C","0","48.62","0","0","1665581098.21193",NA
"63","B00SKVYB38","Imetec Bellissima GM9 90 Multistyler 9 in 1","0","33.99","0","0","1665581120.80378",NA
"64","B0067HDPO8","Imetec ECO KE1 1000 Asciugacapelli, 1400 W con Prestazioni da 2000 W, Tecnologia a Ioni, Diffusore Incluso, 8 Combinazioni Aria/Temperatura, Beccuccio Stretto","0","43.9","0","0","1665581143.05712",NA
"65","B00DP3SM4K","Imetec ECO CE1 1000 Asciugacapelli, 1400 W con Prestazione da 2000 W, Diffusore Incluso, 3 Combinazioni Aria/Temperatura","0","36.9","0","0","1665581165.19037",NA
"66","B015O6ABIA","Imetec Bellissima Anniversary BA2 200 Piastra per Capelli, Liscio dalla Radice alle Punte, Piastre Larghe, Rivestimento in Ceramica, Regolazione della Temperatura da 160°C a 230°C","0",NA,"0","0","1665581187.75459",NA
"67","B00O4QVS66","Imetec Bellissima P2 2200 Asciugacapelli Professionale, Potenza 2200 W, Tecnologia a Ioni per Idratare i Capelli e Ridurre l'Effetto Crespo, 8 Combinazioni Aria/Temperatura, Beccuccio Stretto","0","39.99","0","0","1665581210.49543",NA
"68","B01HU6D86O","Bellissima Imetec CT1 2000 Asciugacapelli da Viaggio, 1400 W, Doppio Voltaggio, Manico Pieghevole, Tasto Regolazione Aria e Temperatura, Custodia da Viaggio Inclusa","0","18.88","0","0","1665581232.82405",NA
"69","B005FBTFU0","Imetec Power To Style C12 2000 Asciugacapelli, 2000 W, Design Compatto, Elevata Praticità d'Uso, Asciugatura Rapida, 2 Combinazioni Aria/Temperatura","0","27.49","0","0","1665581254.69395",NA
"70","B0063RMB1K","Imetec ECO SE1 800 Asciugacapelli, 1400 W con Prestazioni da 2000 W, Beccuccio Stretto, 8 Combinazioni Aria/Temperatura","0","36.9","0","0","1665581276.7898",NA
"71","B00KJ2GXIC","Imetec K5 Power To Style Asciugacapelli 2200 W, Asciugatura Veloce e Delicata, Tecnologia a Ioni per Idratare e Ridurre l'Effetto Crespo, 8 Combinazioni Aria/Temperatura, Colpo d'aria fredda","0","23.99","0","0","1665581299.88601",NA
"72","B009E7CGDO","Imetec Salon Expert E15 50 Piastra per Capelli, Styling Liscio o Mosso, Regolazione Elettronica della Temperatura da 140°C a 230°C, Rivestimento in Nanoceramica per la Protezione Ottimale del Capello","0","54.9","0","0","1665581321.93663",NA
"73","B00B2K8LH6","Bellissima Imetec Revolution BHS1 100 Piastra per Capelli Automatica, Sistema di Rotazione che Modella Ottimamente la Ciocca, Rivestimento in Ceramica, Regolazione della Temperatura da 120°C a 210°C","0","68.92","0","0","1665581344.56663",NA
"74","B015O6AFMM","Imetec Bellissima Anniversary Mini BMA1 100 Piastra per Capelli, Rivestimento in Ceramica, Design Compatto, Sistema di Riscaldamento Rapido Pronto all'Uso","0","24.3","0","0","1665581366.87116",NA
"75","B002YY6LZS","Imetec Bellissima Mini MC210 Piastra per Capelli","0","26.39","0","0","1665581389.41276",NA
"76","B00N4K5PDK","Bellissima Imetec GH16 400 Spazzola ad Aria Modellante con 2 Accessori di Styling, Diametro 25 mm, Potenza 400 W, 2 Combinazioni Flusso d'Aria/Temperatura, Puntale Antiscottatura","0","24.99","0","0","1665581411.83983",NA
"77","B002YY6LXA","Bellissima Imetec B20 50 Piastra per Capelli, Liscio Impeccabile, Design Slim, Piastre Lunghe, Rivestimento in Nanoceramica e Cristalli di Giada, Regolazione della Temperatura fino a 200°C","0","32.99","0","0","1665581433.76797",NA
"78","B00765DSJM","Imetec Bellissima Magic Texture B12 100","0",NA,"0","0","1665581455.33283",NA
"79","B01JOLV9F0","Bellissima Imetec Revolution BHS4 100 Spazzola ad Aria Modellante, 2 Spazzole da 40 e 50 mm, Doppio Verso di Rotazione, Tecnologia a Ioni, Potenza 1000 W, Rivestimento in Ceramica","0","45.2","0","0","1665581477.68965",NA
"80","B01LZMBQRG","Imetec Salon Expert P11 2100 Asciugacapelli Professionale, 2100 W, Velocità Flusso d'Aria in Uscita a 142 km/h, Rivestimento in Ceramica e Tormalina, 8 Combinazioni Aria/Temperatura","0","27.99","0","0","1665581500.09948",NA
"81","B01M0Z17OK","Imetec Salon Expert GT18 100 Arricciacapelli, Diametro Ferro 19 mm, Temperatura fino a 200°C","0","18.99","0","0","1665581522.5689",NA
"82","B01N75NYSJ","Imetec Bellissima Revolution BHS6 100 Piastra per Capelli Frisè, Sistema Riscaldato a Tecnologia Rotante, Effetto Frisè Impeccabile e Duraturo, Rivestimento in Ceramica per Capelli Protetti","0","42.16","0","0","1665581544.75045",NA
"83","B00GAP6M1K","Imetec Salon Expert P11 2100 Asciugacapelli Professionale, 2100 W, Velocità Flusso d'Aria in Uscita a 142 km/h, Rivestimento in Ceramica e Tormalina, 8 Combinazioni Aria/Temperatura","0","27.99","0","0","1665581567.03837",NA
"84","B00CTLDY4W","Bellissima Imetec PC5 2500 Asciugacapelli Professionale, 2000 W, Rivestimento in Ceramica e Tormalina, Tecnologia a Ioni , 8 Combinazioni Aria/Temperatura, Beccuccio Stretto, Diffusore capelli ricci","0","35.35","0","0","1665581589.60814",NA
"85","B01N55NF5G","Bellissima Imetec Creativity Color Shine B22 100 Piastra per Capelli Colorati, Rivestimento in Tessuto per la Protezione dei Capelli, temperatura regolabile da 150°C a 230°C","0","43.99","0","0","1665581612.1023",NA
"86","B06WGV3DBP","Bellissima Imetec Beach Waves Gt20 100 Piastra Per Capelli A Onde Larghe E Strette, Rivestimento in ceramica, temperatura regolabile","0","36.99","0","0","1665581634.8007",NA
"87","B06WP9PPT6","Bellissima Imetec Intellisense B24 100 Piastra per Capelli Lisci e Mossi a 60° C in Meno con Tecnologia Intellistyle, Rivestimento in Ceramica, 5 Livelli di Temperatura","0","64","0","0","1665581656.93228",NA
"88","B06XWKNJQJ","Bellissima Imetec Magic Straight Brush PB5 100 Spazzola Elettrica Lisciante per Capelli, Effetto Liscio Naturale, Setole Rivestite in Ceramica, Fino a 200° C, Tecnologia Ioni","0","29.99","0","0","1665581679.10582",NA
"89","B072MSQDQG","Bellissima Imetec B26 100 Piastra per Capelli Lunghi o Difficili da Disciplinare, Formato Extra Large, Rivestimento in Ceramica, 160° C - 230° C","0","31.19","0","0","1665581702.0818",NA
"90","B071JZG665","Imetec Power To Style S8 2100 Asciugacapelli, 2100 W, Extra Performance, con Beccuccio Direzionabile, Funzione Fast Drying per un'Asciugatura Rapida, 3 Combinazioni Aria/Temperatura","0","17.99","0","0","1665581724.17832",NA
"91","B071WXJWH8","Bellissima Imetec PB9 1200 Magic Brush Zero Tangles Spazzola Lisciante Districante ad Aria, Districa e Asciuga, Incluse 2 Spazzole per Sciogliere Nodi e Lucidare i Capelli","0",NA,"0","0","1665581746.39782",NA
"92","B009E7CN6O","Imetec Bellissima Magic Style PB3 38 Spazzola Professionale Riscaldata, Diametro 38 mm, Rivestimento in Ceramica e Cristalli di Giada, Sistema Anti Efetto Crespo, Guida Styling Inclusa","0",NA,"0","0","1665581768.49044",NA
"93","B00G3DNXIE","Bellissima Imetec S5 2200 Asciugacapelli, 2200 W, Asciugatura Rapida e Styling a Lunga Durata, 8 Combinazioni Aria/Temperatura, Colpo d'Aria Fredda","0","23.9","0","0","1665581790.56025",NA
"94","B00E3QGPQK","Bellissima Imetec K5 2200 Asciugacapelli 2200 W, Asciugatura Veloce e Delicata, Tecnologia a Ioni per Idratare e Ridurre l'Effetto Crespo, 8 Combinazioni Aria/Temperatura, Diffusore capelli ricci","0","39.99","0","0","1665581813.04636",NA
"95","B007YH05O8","Imetec Bellissima Magic Style PB1 38 Spazzola Professionale Riscaldata","0","59.99","0","0","1665581834.91773",NA
"96","B0089LSRHK","Imetec Bellissima Magic Style PB2 30, Spazzola Professionale Riscaldata, Rivestimento in Gloss Titanium Ceramic, Tecnologia agli Ioni, Diametro 30 mm","0","27.5","0","0","1665581857.53668",NA
"97","B0089LSRL6","Imetec Bellissima Magic Style PB2 30, Spazzola Professionale Riscaldata, Rivestimento in Gloss Titanium Ceramic, Tecnologia agli Ioni, Diametro 30 mm","0","27.5","0","0","1665581879.82118",NA
"98","B06XPBXNCX","Imetec Bellissima Mini HS 500 Piastra per Capelli Mini, Design Compatto Ideale, Rivestimento in Ceramica, Bianca","0",NA,"0","0","1665581901.99259",NA
"99","B075RGG4Y5","Bellissima Imetec Creativity B27 100 Piastra Per Capelli Con Rivestimento In Ceramica E Controllo Della Temperatura, Temperatura Egolabile 150°C / 230°C, Multicolore","0","43.99","0","0","1665581925.11628",NA
"100","B075RFR2CV","Bellissima Imetec GT15 200 Ferro Arricciacapelli con Rivestimento in Ceramica, Forma Conica, Controllo della Temperatura","0","24.99","0","0","1665581947.66096",NA
"101","B075RFNP23","Imetec Eco SE1 1000 Asciugacapelli con Tecnologia Eco Efficiency, 1400 W, 8 Combinazioni Aria/Temperatura, Diffusore per Capelli Ricci, Nero/Verde","0","28.9","0","0","1665581969.99032",NA
"102","B075RFR89L","Imetec Bellissima Magic Straight Wet&Dry Brush Spazzola Elettrica Lisciante con Soffio d'Aria e Setole Riscaldate, Rivestimento in Ceramica e Tormalina, 3 Impostazioni d'Uso","0","29.99","0","0","1665581992.28207",NA
"103","B076FWLL9C","Imetec Bellissima Beach Waves Multi Star Edition GT 20 200 Piastra per Capelli con Rivestimento in Ceramica e Tormalina per fare Onde Larghe e Strette, Effetto Naturale, Beauty Bag Termica Inclusa","0","40.99","0","0","1665582014.28282",NA
"104","B00U7FFR0G","Imetec Bellissima B11 50 Piastra per Capelli Lisci e Morbidi con Rivestimento in Ceramica con Cristalli di Giada, Regolazione Elettronica della Temperatura da 120°C a 200°C","0",NA,"0","0","1665582036.45955",NA
"105","B079FN8N4T","Bellissima Imetec BM 200 Piastra Mini per Capelli Lisci e Luminosi, Temperatura 200°, Multivoltaggio Automatico, Dimensioni Compatte da Viaggio","0","16.9","0","0","1665582059.05035",NA
"106","B0154Z2W06","Bellissima Imetec B21 100 Piastra per Capelli Lisci e Luminosi con Rivestimento in Ceramica, Temperatura 210°C, Piastre Riscaldate Oscillanti per Elevata Efficacia di Stiratura","0","22.54","0","0","1665582080.97903",NA
"107","B01BNTLKU0","Imetec Bellissima Ultra PC6 2000 Asciugacapelli Professionale con Tecnologia Doppia Turbina Brevettata, 2000 W, 2 Beccucci e Diffusore, Rivestimento Griglia in Ceramica e Tormalina, Nero/Rosa","0",NA,"0","0","1665582103.20218",NA
"108","B079ZLWJNJ","Imetec Salon Expert P3 3200 Asciugacapelli Professionale, 2200 W, Griglia con Rivestimento in Ceramica, Tecnologia a Ioni, 8 Combinazioni Aria/Temperatura","0","29.99","0","0","1665582125.30493",NA
"109","B079Z9GXQS","Imetec Salon Expert P5 3600 Asciugacapelli Professionale, 2300 W, Griglia con Rivestimento in Ceramica e Cheratina, Tecnologia a Ioni, 8 Combinazioni Aria/Temperatura, 2 Beccucci","0","45.99","0","0","1665582148.13176",NA
"110","B07FZ4PVRP","Bellissima Imetec Steam B28 100 Piastra per Capelli Professionale a Vapore, Effetto Liscio a Lungo, Ceramica, Temperatura Regolabile 170°C - 200°C - 230°C, Riscaldamento Rapido","0","50.9","0","0","1665582170.62388",NA
"111","B07JVLQ38M","Imetec Bellissima My Pro Ceramic P5 3800 Asciugacapelli Professionale Per Capelli Morbidi E Luminosi, Tecnologia Ceramica, 2300 W, Nero Oro","0","61.2","0","0","1665582192.7287",NA
"112","B07FYHM3QY","Bellissima Imetec Magic Straight Brush PB11 100 Spazzola Elettrica Lisciante, 3 Lati Esterni Riscaldati, Spegnimento automatico, Tecnologia a Ioni, Ceramica, 160 C°- 210°C, Nero/Oro rosa","0","53.5","0","0","1665582214.91753",NA
"113","B0158FIIGE","Imetec Bellissima SD5 2000 Asciugacapelli, 2200 W, 8 Combinazioni Aria/Temperatura, Diffusore per Ricci, Anello di Aggancio.","0","23.9","0","0","1665582237.16178",NA
"114","B07P35CW1X","Bellissima Imetec Beach Waves GT20 300 Piastra per Capelli, Rivestimento in Ceramica, Onde Larghe e Strette, Effetto Naturale, 3 Livelli Temperatura 160 C°- 200°C, Borsa termica inclusa","0","40.99","0","0","1665582259.59571",NA
"115","B07S5L8VYG","Bellissima Imetec Magic Style Brush P2 30 Spazzola Riscaldata, Capelli Liscio Effetto Naturale/Mosso Sostenuto, Diametro 30 mm, Tecnologia a Ioni, Rivestimento Ceramica, Nero/Oro rosa","0","34.9","0","0","1665582282.2589",NA
"116","B07S73QCFC","Bellissima Imetec 2 In 1 Straight&Waves Piastra Capelli, Capelli Effetto Liscio o onde Beach Waves, Rivestimento in Ceramica, 4 Livelli di Temperatura da 150°C a 210°C, Piastre XL 5 x 9,5 cm","0",NA,"0","0","1665582304.62872",NA
"117","B07S5L9937","Bellissima Imetec My Pro Creativity Infrared B8 200, piastra lisciante, tecnologia raggi infrarossi, rivestimento in ceramica e cheratina, 11 livelli di temperatura da 130 °C a 230 °C, cavo 1,8 m","0","62.99","0","0","1665582327.38933",NA
"118","B07V9GN42Q","Bellissima Imetec 2 In 1 Straight&Waves Piastra per Capelli con Doppio Profilo, Capelli Effetto Liscio o onde Beach Waves, Rivestimento in Ceramica, 4 Livelli di Temperatura da 150°C a 210°C","0","44.99","0","0","1665582350.18909",NA
"119","B00HLUUNOK","Bellissima Imetec Creativity B15 50 Piastra per Capelli, Styling Liscio o Mosso, Rivestimento in Nanoceramica, Regolazione della Temperatura da 140°C a 230°C, Piastre Oscillanti","0","39.99","0","0","1665582373.147",NA
"120","B07W3VJQZD","Bellissima Imetec GH18 1100 Modellatore ad Aria, Rivestimento spazzole in Ceramica, 5 Accessori per Realizzare Capelli Lisci e Luminosi, a Onde morbide o Ricci Stretti, 1000 W","0","33.99","0","0","1665582396.10652",NA
