"","asin","product_name","sku","price_cleaning","native_price","discount_percentage","date","X..i.."
"401","B00FGRYW7O","Imetec Titanox Eco K112 Ferro da Stiro a Vapore, Piastra in Acciaio Inox","0","28.99","0","0","1665590633.37497",NA
"402","B00GLSDCS2","Imetec Nuvola Ferro da Stiro da Viaggio a Vapore, Piastra in Acciaio Inossidabile da 1000 W, Custodia da Viaggio, Doppio Voltaggio","0","22.99","0","0","1665590655.37751",NA
"403","B005U1WNWC","Imetec Zerocalc Eco Professional 2400 Ferro da Stiro a Vapore, Piastra in Acciaio Inox","0","39.99","0","0","1665590677.19435",NA
"404","B00O3X8VZG","Imetec Titanox Eco K116 Ferro da Stiro a Vapore, Piastra in Acciaio Inox","0","28.99","0","0","1665590699.25273",NA
"405","B00TDNGVX0","Imetec Titanox Eco K114 Ferro da Stiro a Vapore, Piastra in Acciaio Inox","0","21.99","0","0","1665590721.22005",NA
"406","B015WNPAYK","Imetec Intellivapor Prestige Ferro da Stiro Generatore di Vapore, Tecnologia Intellivapor, 4.5 BAR Pump, Colpo Vapore 200 G, Tecnologia a Risparmio Energetico, Tecnologia NoStop","0",NA,"0","0","1665590743.27938",NA
"407","B01BGRZY10","Imetec Intellivapor Professional Ferro da Stiro, Generatore di Vapore, Tecnologia Intellivapor, 4.8 bar Pressione alla Pompa, Colpo Vapore 230 g, Tecnologia a Risparmio Energetico, Tecnologia NoStop","0","69.99","0","0","1665590765.1399",NA
"408","B011DHJIRE","Imetec Zerocalc Eco K4 2400 Ferro da Stiro, Bianco","0","7.69","0","0","1665590787.25907",NA
"409","B0050IJ3V4","Imetec Titanox K109 Ferro da Stiro a Vapore, Piastra in Acciaio Inox","0","28.99","0","0","1665590809.21712",NA
"410","B0050IJ8J6","Imetec Eco Compact Sistema Stirante","0",NA,"0","0","1665590831.28156",NA
"411","B01EYQUL2M","Imetec Titanox K113 Ferro da Stiro a Vapore, Piastra in Acciaio Inossidabile 2100 W, Leggero e Maneggevole, Colpo Vapore 90 g, Vapore Regolabile","0",NA,"0","0","1665590853.79983",NA
"412","B01EO697BI","Imetec Titanox K109 Ferro Da Stiro A Vapore, Piastra In Acciaio Inossidabile Multiforo Da 2000 W, Bianco Blu","0","16.99","0","0","1665590876.25761",NA
"413","B01LZXN3WK","Imetec Intellivapor Expert IM2500 Ferro con Caldaia ad Alta pressione, Tecnologia Intellivapor, Tecnologia a Risparmio Energetico, Piastra e Caldaia in Acciaio Inossidabile","0",NA,"0","0","1665590898.54573",NA
"414","B01LX03UPH","Imetec Intellivapor Expert IM2500 Ferro con Caldaia ad Alta pressione, Tecnologia Intellivapor, Tecnologia a Risparmio Energetico, Piastra e Caldaia in Acciaio Inossidabile","0",NA,"0","0","1665590920.58275",NA
"415","B01LYMRVA3","Imetec Zerocalc Pro 2300 Ferro da Stiro a Vapore ad Alte Prestazioni, Piastra in Acciaio Inossidabile da 2300 W, Tecnologia Anticalcare, Tecnologia a Risparmio Energetico","0","50.99","0","0","1665590942.95911",NA
"416","B01LZA1IHE","Imetec Intellivapor K1 Ferro da Stiro a Vapore, Tecnologia Intellivapor, Piastra in Acciaio Inossidabile da 2300 W, Tecnologia a Risparmio Energetico","0","27.49","0","0","1665590965.0357",NA
"417","B01M09BNCN","Imetec Intellivapor K3 Ferro da Stiro a Vapore, Tecnologia Intellivapor, Piastra in Acciaio Inossidabile da 2300 W, Tecnologia a Risparmio Energetico","0",NA,"0","0","1665590987.29546",NA
"418","B01LY802Z9","Imetec Intellivapor K5 Ferro da Stiro a Vapore, Tecnologia Intellivapor, Piastra in Acciaio Inossidabile da 2400 W, Tecnologia a Risparmio Energetico","0","27.49","0","0","1665591009.24778",NA
"419","B01M0KZ2PI","Imetec Zerocalc Pro 2200 Ferro da Stiro a Vapore ad Alte Prestazioni, Piastra in Acciaio Inossidabile da 2200 W, Tecnologia Anticalcare, Tecnologia a Risparmio Energetico","0",NA,"0","0","1665591031.52203",NA
"420","B00FGRZ3PY","Imetec Zerocalc Eco K3 2300 Ferro da Stiro a Vapore, Piastra in Acciaio Inox","0","28.99","0","0","1665591053.69318",NA
"421","B00NU25TGA","Imetec No-Stop Eco Prestige Sistema Stirante, Ferro da Stiro con Piastra in Acciaio Inox e Generatore di Vapore","0","89.99","0","0","1665591075.84809",NA
"422","B07CKY9SNZ","Imetec ZeroCalc Z1 2500 Ferro da Stiro, Tecnologia Anticalcare, Piastra Inox 2200 W, Colpo Vapore 120 g","0","21.99","0","0","1665591098.24574",NA
"423","B07CKRCMB7","Imetec Zerocalc Z3 3500 Ferro Da Stiro, Tecnologia Anticalcare, Piastra Inox 2400 W, Colpo Vapore 150 G, Bianco Blu","0","28.99","0","0","1665591120.54006",NA
"424","B01D401T6Q","Lunghezza cavo (m) 2 Eco Compact Ferro da Stiro Compatto, Bianco","0",NA,"0","0","1665591142.77211",NA
"425","B07MZGRDJ4","Imetec Zerocalc Z3 3700 Ferro da Stiro, Tecnologia Anticalcare, Piastra Ceramica ad Alta Scorrevolezza, 2400W, Colpo Vapore 160 G, 0,3 litri, Dispositivo Antigoccia Tecnologia a Risparmio Energetico","0","39.99","0","0","1665591165.10727",NA
"426","B07P35DTPJ","Imetec ZeroCalc PS1 2000 Ferro da Stiro Compatto, 3.8 BAR, Tecnologia Anticalcare e a Risparmio Energetico, Ricarica Continua, Vapore Pronto in 1 Minuto, 2100 W, Serbatoio XL da 1 L, Bianco/Blu","0","89.99","0","0","1665591187.28526",NA
"427","B07NYRRF1Y","Imetec ZeroCalc Z3 3900 Ferro da Stiro a Vapore, Tecnologia Anticalcare, Tecnologia Intellivapor (temperatura unica ideale per tutti i tessuti), Piastra Ceramica, 2400 W, Colpo Vapore 170 g","0","42.99","0","0","1665591209.80755",NA
"428","B07PPC54RD","Imetec ZeroCalc Z1 2800 Ferro da Stiro con Tecnologia Anticalcare, Piastra Ceramica ad Alta Scorrevolezza, Tecnologia a Risparmio Energetico, 2200 W, Colpo Vapore 130 g","0","29.99","0","0","1665591231.78509",NA
"429","B07QZFLKRS","Imetec ZeroCalc PRO PS2 2200 Ferro da Stiro Generatore di Vapore, Tecnologia Anticalcare, fino a 5.6 BAR pump, Colpo Vapore 240 g, Piastra in Acciaio Inox, 3 filtri con Ioni d’Argento","0","115.99","0","0","1665591254.91198",NA
"430","B07S61V42S","Imetec ZeroCalc KF1 100 Kit 3 filtri anticalcare per Ferri da Stiro Imetec ZeroCalc Pro Ceramic PS2 2400, PS2 2000, PS2 2200, Intellivapor PS3 3000, Imetec Onda, Ricambi Originali","0","22.99","0","0","1665591277.2302",NA
"431","B00MHFT4DK","Imetec Titanox Eco K107 Ferro da stiro a vapore, Tecnologia a risparmio energetico, 2000 Watt, Piastra in acciaio inox autopulente, Vapore Regolabile, Getto di vapore 40 g, lunghezza cavo 2 mt","0",NA,"0","0","1665591299.65617",NA
"432","B09SDHHKJZ","Imetec Intellifast, ferro da stiro a vapore, Tecnologia Intelli System, Impostazione automatica della temperatura, Piastra Ceramic Diamond, Protezione anticalcare, 2400 W, Colpo Vapore 200 g","0","50.99","0","0","1665591321.50553",NA
"433","B004ASNGM2","Imetec Living Air HU-200 Umidificatore, Autonomia fino a 12 Ore, Emissione Vapore Regolabile, Dispositivo Antiapertura di Sicurezza, Vaschetta Porta Fragranze","0",NA,"0","0","1665591343.18827",NA
"434","B0050IGWXG","Imetec Living Air HU-100 Umidificatore Compatto, Autonomia Fino a 9 Ore, Emissione Vapore Regolabile, Dispositivo Antiapertura di Sicurezza","0","49.99","0","0","1665591365.06934",NA
"435","B008HR0UG2","Imetec 8428 ricambi Piuma Excellent, Carta","0","13.4","0","0","1665591387.13448",NA
"436","B008HR7LB4","Imetec 8004 Kit Ricambi, 10 Sacchetti, 2 Filtri Aria, 1 Filtro Motore per Scopa Elettrica Imetec Piuma","0",NA,"0","0","1665591408.63479",NA
"437","B009E7AKTQ","Imetec 8505 Kit Ricambi, 10 Sacchetti e 1 Filtro Motore per Scopa Elettrica Imetec ECO E6","0","13.9","0","0","1665591431.15034",NA
"438","B009K23650","Imetec 8506 Kit Sacchetti e Filtro, per Aspirapolvere Eco Allergy","0","12.9","0","0","1665591452.80371",NA
"439","B01BV0NOOG","Imetec 8064 Kit Ricambi, 2 Panni in Microfibra per Scopa a Vapore Imetec Master Vapor Detergent Plus SM04","0","29.9","0","0","1665591474.97947",NA
"440","B00YAF2X1K","Imetec Winbot W710 Kit Ricambi per Robot Pulisci Vetri e Finestre","0",NA,"0","0","1665591496.55495",NA
"441","B00PLSNWU6","Imetec Winbot W710 Kit Cavo Prolunga per Robot Pulisci Vetri e Finestre","0",NA,"0","0","1665591518.23624",NA
"442","B01BV0NNBK","Imetec 8098 Kit Panni di Ricambio per Scopa a Vapore Master Vapor Plus SM02","0",NA,"0","0","1665591540.34349",NA
"443","B00KMU8US2","Imetec 8140 Kit Ricambi 3 Panni In Microfibra Per Scopa A Vapore Imetec Master Vapor SM01, ‎Bianco","0","16.99","0","0","1665591562.56175",NA
"444","B00KMU8XAC","Imetec Winbot W710 Kit Panni di Ricambio per Robot Pulisci Vetri e Finestre","0",NA,"0","0","1665591583.96695",NA
"445","B01BV0NOQ4","Imetec 8166 Kit Ricambi, 4 Panni in Microfibra Scopa a Vapore Imetec Master Vapor Detergent SM03","0",NA,"0","0","1665591605.65854",NA
"446","B0158R6RLK","Imetec 8066 Sacchetti e Filtri per Aspirapolvere Silence Eco Extreme","0","13.9","0","0","1665591627.6581",NA
"447","B00YAF31EI","Imetec 8392 Kit Ricambi, 5 Sacchetti, 1 Filtro Hepa, 1 Filtro Motore per Aspirapolvere Imetec Eco E3","0","19.9","0","0","1665591649.9376",NA
"448","B00UX6KK0G","Imetec 8621 Kit Ricambi, 5 Sacchetti, 1 Filtro Aria, 1 Filtro Motore per Aspirapolvere Imetec Driver e Imetec Eco E5","0",NA,"0","0","1665591671.25595",NA
"449","B08J8XH5BH","Bellissima Imetec Twist & Style GT22 100, Manico per Styler Arricciacapelli per Onde e Ricci, Temperatura Automatica, Riscaldamento Rapido, Orientabile a 90°, Accessori non Inclusi","0","33.12","0","0","1665591693.84947",NA
"450","B08J8XNFNC","Bellissima Imetec GT22 110, Accessorio Soft Curls per Styler Arricciacapelli Twist & Style, Ferro Riscaldato da 25 mm, Rivestimento in Ceramica, Temperatura 185°C","0","29.99","0","0","1665591716.26115",NA
"451","B08J8XCSH4","Bellissima Imetec GT22 120, Accessorio Sculpted Curls per Styler Arricciacapelli Twist & Style, Ferro Riscaldato da 11 mm, Rivestimento in Ceramica, Temperatura 185°C","0","23.85","0","0","1665591738.82114",NA
"452","B08J8XCSHB","Bellissima Imetec GT22 130, Accessorio Loose Waves per Styler Arricciacapelli Twist&Style, Ferro Riscaldato ad Ellisse, Diametro da 26 a 38 mm, Rivestimento Ceramica, Temperatura 190°C","0","28.66","0","0","1665591761.04192",NA
"453","B08J8XN21F","Bellissima Imetec GT22 140 Accessorio Glamour Waves per Styler Arricciacapelli Twist&Style, Ferro Riscaldato Forma Conica, Diametro 13/38 mm, Rivestimento in Ceramica, Temperatura 190°C","0","29.99","0","0","1665591783.5584",NA
"454","B08J8XPY5X","Bellissima Imetec Hydra Sonic Asciugacapelli, Motore Digitale, Ionizzatore a Doppia Azione, 3 Velocità, 3 Temperature Compatto, Leggero, 3 Accessori Aggancio Magnetico, Custodia da Viaggio","0","186.99","0","0","1665591806.20697",NA
"455","B08HS77R9B","Imetec Cukò Maestro, Robot da cucina con cottura, 20 programmi, 10 funzioni, Impasta Pane e Pizza, capienza 2 L, Fino a 6 porzioni, 8 accessori, ricettario, 1000 W","0","249.99","0","0","1665591828.0566",NA
"456","B08HR1VGSR","Imetec Scaldasonno Adapto Maxi Coprimaterasso Singolo 195x90 cm, Riscaldamento Rapido, Temperatura Costante e Personalizzata, Tessuto Anallergico Trapuntato, Comando con 6 Temperature","0","74.99","0","0","1665591850.053",NA
"457","B08HR23S41","Imetec Scaldasonno Adapto Maxi Coprimaterasso Matrimoniale 195x165 cm, Riscaldamento Rapido, Temperatura Costante e Personalizzata, Tessuto Anallergico Trapuntato, Doppio Comando, 6 Temperature","0","144.99","0","0","1665591873.30298",NA
"458","B08J8Z15M1","Imetec Adapto Velvet Square plaid riscaldabile, coperta elettrica 150x95 cm tessuto morbido, Tecnologia Adapto, Dispositivo di sicurezza, rapido riscaldamento, 6 temperature, lavabile in lavatrice","0","49.99","0","0","1665591895.41376",NA
"459","B08J8ZLLDT","Imetec Adapto Velvet Jacquard plaid riscaldabile, coperta elettrica 140x180 cm tessuto morbido, Tecnologia Adapto, Dispositivo di sicurezza, rapido riscaldamento, 6 temperature, lavabile in lavatrice","0","85","0","0","1665591917.41176",NA
"460","B08J8ZH957","Imetec Adapto Velvet Tartan plaid riscaldabile con tasca mani e piedi, coperta elettrica 150x110 cm, Tecnologia Adapto, Dispositivo di sicurezza, rapido riscaldamento, 6 temperature, lavabile","0","81.9","0","0","1665591940.06808",NA
"461","B08J8XMFQN","Imetec Scaldasonno Adapto Maxi Coprimaterasso Matrimoniale 195 x 165 cm, Riscaldamento Rapido, Temperatura Costante e Personalizzata, 100% Lana e Merino, Doppio Comando, 6 Temperature","0","216.99","0","0","1665591962.34537",NA
"462","B08J8XJHNM","Imetec Adapto Velvet Tartan plaid riscaldabile, coperta elettrica 160x120 cm tessuto morbido, Tecnologia Adapto, Dispositivo di sicurezza, rapido riscaldamento, 6 temperature, lavabile in lavatrice","0","66.99","0","0","1665591985.27913",NA
"463","B08JVC7VB4","Imetec Crea&Crema Sbattitore Elettrico, Fruste Extralunghe per Impasti Dolci e Panna Montata, Ganci Acciaio Inox per Impastare, 5 Velocità, Funzione Turbo, Design Ergonomico, 500 W","0","26.99","0","0","1665592007.97284",NA
"464","B08JV8L49M","Imetec TostaMaxi Tostapane, 2 Fessure Extralarge e Pinze Apribili per Toast Extrafarciti, 10 livelli di doratura, Timer con Autospegnimento, Cassetto Raccoglibriciole, 600 W","0","49.99","0","0","1665592030.59784",NA
"465","B08JV9LX42","Imetec La TostaGriglia, tostiera, Piastre XL Rigate e Antiaderenti, Interruttore ON/OFF, Spia Riscaldamento Piastre, Gancio Chiusura, Avvolgicavo, Tostapane Compatto, 900 W","0","45.99","0","0","1665592053.10525",NA
"466","B08JV8FFYH","Imetec Griglia&Gusta Bistecchiera, Piastre Antiaderenti Removibili, Rivestimento Triplo Strato al Titanio Stone-Look, Grill con 7 Posizioni, 3 Funzioni di Cottura, Thermo Control, 2000 Watt","0","97","0","0","1665592075.79225",NA
"467","B08JVCHZF3","Imetec FrullaTutto Frullatore, Lame Tritaghiaccio in Acciaio Inox, Bicchiere da 800 ml in Vetro Antigraffio, 2 Velocità, Funzionamento Impulsi, 500 W, 2 Velocità, Lavabile Lavastoviglie","0","39.99","0","0","1665592097.78552",NA
"468","B08JV9VVQT","Imetec La Grattugia, grattugia elettrica, Rullo in Acciaio Inox, Tramoggia in Alluminio, Contenitore Estraibile con Coperchio Salvafreschezza, Sistema di Sicurezza, 150 W","0","109","0","0","1665592120.30753",NA
"469","B08JV7QK54","Imetec La Panetteria +Zeroglu, Macchina per Pane, Ciabatte, Panini, Dolci con Farine Naturali e Senza Glutine, 20 Programmi, 2 Pale Impastatrici, Temperatura di Lievitazione Controllata, Marrone","0","189","0","0","1665592143.29476",NA
"470","B08JV87TZW","Imetec Succovivo SJ4 1300 Estrattore di Succo Professionale a Freddo, Spremitura Lenta 50 Giri/Min, Filtro per Succhi, Accessorio per Granite e Sorbetti, pulizia in 2 minuti","0","129.99","0","0","1665592165.87091",NA
"471","B08NKXBJX1","Bellissima Imetec Beach Waves Gt20 400 Piastra Per Capelli per onde larghe e strette, Rivestimento In Ceramica, temperatura regolabile 160 C°- 200°C","0","40.99","0","0","1665592188.65374",NA
"472","B08NK1L69Z","Imetec TritaMax, Tritatutto, 4 Lame in Acciaio Inox, Capiente Contenitore 600 ml, Accessorio Frusta per Salse e Panna Montata, 2 velocità, 500 Watt","0","34.99","0","0","1665592211.15994",NA
"473","B08NK25BLP","Imetec Frulla&Crea Frullatore a Immersione, 3 Accessori, Tritatutto, Frusta e Bicchiere BPA free, Piede Large, 2 Velocità, 1000 W, 15000 Giri Minuto","0","38.94","0","0","1665592233.06688",NA
"474","B08NPR8QNN","Imetec TritaCompact Tritatutto, Lame in Acciaio Inox, Capienza Contenitore 400 ml, Funzionamento a Pressione, Compatto, 350 W, Bianco e Salvia","0","30.99","0","0","1665592255.59117",NA
"475","B08NPMMFWQ","Imetec Tritapiù Tritatutto, 4 Lame in Acciaio Inox, Capiente Contenitore 600 ml, 18.000 Giri/min, Funzionamento a Pressione, 1000 W, Materiali BPA Free, Bianco/Verde","0","56.99","0","0","1665592278.18194",NA
"476","B08NPF5HWD","Imetec Frulla&Trita Frullatore a Immersione, Lame in Acciaio Inox, Piede Extra Large, Gambo Estraibile, Bicchiere graduato da 1 Litro, 800 Watt, 15.000 Giri Minuto","0","45.99","0","0","1665592300.70818",NA
"477","B08NP5M6D4","Imetec FrescoAroma Macina Caffè e Spezie, Pepe, Zucchero, Frutta Secca Elettrico con Lame in Acciaio Inox, Contenitore Salva-Freschezza, Funzionamento a Impulsi, 150 W","0","29.99","0","0","1665592323.01982",NA
"478","B08NPR9BYM","Imetec FrullaRapido, Frullatore a Immersione, Gambo XL in Acciaio, Lame in Acciaio Inox, Funzionamento a Impulsi, 450 W","0","24.99","0","0","1665592345.04569",NA
"479","B08NPG5D5Y","Imetec BuonFrullato, Frullatore Compatto, Bicchiere in Plastica BPA Free, Capacità 700 ml, Coperchio Dosa Liquidi, 400 W","0","23.9","0","0","1665592367.81148",NA
"480","B0813TLPGY","Imetec ZeroCalc PS1 2200, Ferro da Stiro Compatto, fino a 4 BAR di Pressione alla Pompa, Tecnologia Anticalcare e a Risparmio Energetico, Ricarica Continua, Vapore Pronto in Un Minuto, 2100 W","0","64.9","0","0","1665592390.50543",NA
"481","B07YX5QRCL","Imetec ZeroCalc PRO PS2 2400 Ferro da Stiro Generatore di Vapore, Tecnologia Anticalcare, fino a 5.8 BAR pump, Colpo Vapore 260 g, Piastra in Ceramica scorrevole, 3 filtri con Ioni d’Argento","0",NA,"0","0","1665592413.00503",NA
"482","B08HS4ZSMH","Imetec Onda F2, Ferro da Stiro a Vapore con Piastra a Onde Scorrevole Brevettata, 2400 W, Colpo di Vapore 200g, Serbatoio 300 ml, Tripla Protezione Anticalcare","0","69.9","0","0","1665592435.14941",NA
"483","B08HS61FJ5","Imetec Onda P2 Ferro da Stiro Generatore di Vapore, Piastra a Onde Scorrevole Brevettata, 2400W, Colpo Vapore 300 g, Serbatoio 2,5L, 3 Filtri con Ioni di Argento, Tecnologia No Stop Vapor","0","169.9","0","0","1665592457.26764",NA
"484","B08LVXG2V1","Bellissima Imetec Diffon Ceramic, Diffusore ad Aria Calda per Capelli Ricci, Tecnologia Ceramica, 700 W, 2 Combinazioni Aria/Temperatura, Asciugatura Delicata Senza Effetto Crespo","0","44.99","0","0","1665592479.96128",NA
"485","B08V11MR92","Imetec Eco Perfect Ferro da Stiro a Vapore, Risultati Ottimi con -35% di Consumo di Acqua e -25% di Consumo Energetico, Piastra con Rivestimento Pro Ceramic, Tripla Protezione Anticalcare, 2400 W","0","59.99","0","0","1665592502.3497",NA
"486","B08V1FYMK9","Imetec Intellivapor, Ferro da Stiro Generatore di Vapore, Tecnologia Intelli System, Impostazione Automatica di Vapore e Temperatura, Piastra Ceramica, 2300W, Colpo Vapore 260 g, Filtri Ioni Argento","0","149","0","0","1665592524.71521",NA
"487","B08X7BYVZQ","Bellissima Imetec My Pro Revolution BHS4 1100, Spazzola ad Aria Calda, Asciuga e Modella, Rotazione Automatica a Doppio Verso, 2 Spazzole da 40 e 50 mm, Ionizzatore, 1000 W, Rivestimento in Ceramica","0","45.2","0","0","1665592547.46355",NA
"488","B093C19CSD","Imetec Salon Expert P3 3600 Asciugacapelli, Motore Professionale, 2200 W, Ionizzatore, Griglia Ceramica e tormalina, 8 combinazioni aria temperatura, Concentratore e Diffusore Professionali, Nero","0","32.2","0","0","1665592569.76137",NA
"489","B093BYJXZW","Imetec Salon Expert P11 2300 Asciugacapelli, Motore Professionale, 2100 W, Griglia in Ceramica e Tormalina, 8 Combinazioni Aria Temperatura, Colpo Aria Fredda, Nero","0","27.99","0","0","1665592591.87072",NA
"490","B08R7NM2SF","Imetec Tosta&Griglia, Tostiera Elettrica, Riponibile In Verticale, 800 W, Multicolore","0","33.99","0","0","1665592614.3595",NA
"491","B08X1WLF5W","Imetec SuccoVita, estrattore di succo a freddo facile da usare, estratti di frutta e verdura, sorbetti e latte vegetale, 50 giri/min, imbocco ampio, funzione reverse","0","109.99","0","0","1665592636.64974",NA
"492","B08XBZV29G","Imetec Grattugissima, grattuggia elettrica per formaggio, pane e frutta secca, Contenitore estraibile, coperchio salvafreschezza, 150 W, rullo in acciacio, accessori lavabili in lavastoviglie","0","99.99","0","0","1665592659.0379",NA
"493","B08R7NSVL5","Imetec GranToast, tostapane per toast extra farciti, fessure XL, pinze a fondo chiuso apribili a 360° e regolabili in larghezza, 600 W, 10 livelli doratura, Timer","0","48.98","0","0","1665592681.1078",NA
"494","B08RYGFL21","Imetec Frulla&Gusta, Frullatore con 4 lame in acciaio inox, bicchiare in vetro, 2 velocità e funzionamento impulsi, 500 W, capienza 800 ml, lavabile lavastoviglie, piedini antiscivolo","0","34.99","0","0","1665592703.52399",NA
"495","B08RZ288L3","Imetec La Forneria +Zeroglu 7488, Macchina per Pane, Ciabatte, Panini, Pizza e Dolci anche con Farine Naturali, 20 Programmi, 2 Pale Impastatrici, Temperatura di Lievitazione Controllata, Bianca","0",NA,"0","0","1665592725.76617",NA
"496","B09CTZ6WKM","Bellissima Imetec GT22 150 Accessorio Mermaid Waves per Styler Arricciacapelli Twist&Style, Ferro Riscaldato Forma Bubbles, Diametro 25 mm, Rivestimento in Ceramica, Temperatura 190°C","0","24","0","0","1665592748.66448",NA
"497","B09CTZZGFY","Bellissima Imetec GT22 160, Accessorio Hollywood Waves per Styler Arricciacapelli Twist&Style, Rivestimento in ceramica, Temperatura 190°C, Ovale, Nero, Diametro 38 x 25 mm","0","29.99","0","0","1665592770.79507",NA
"498","B09BJ7LNR6","Bellissima Imetec Steam Elixir, Piastra a Vapore, Capelli lisci in Una Sola Passata Senza Danni, Rivestimento in Ceramica e Olio Argan, Rapido Riscaldamento, 4 Temperature, Tappetino Termoresistente","0","95.9","0","0","1665592793.829",NA
"499","B09BHV4DWG","Bellissima Imetec Air Wonder, Spazzola ad Aria Calda, Tecnologia a ioni, Spazzole Rivestite in Ceramica e Cheratina, Asciuga, Dona Volume, 8 Accessori, 1000 W","0","84.99","0","0","1665592816.56393",NA
"500","B09CTY5P2L","Bellissima Imetec Creativity 4 You, Asciugacapelli Professionale, 4 Accessori, Diffusore, Controllo Intelligente della temperatura, Ion Technology, Beauty Bag, 2 velocità, 3 temperature, 1800 W","0","146.32","0","0","1665592839.42799",NA
"501","B0987B62CP","Imetec Silent Power Comfort, Termoventilatore silenzioso e compatto, Stufetta Elettrica, 2100 W, 4 funzioni, termostato ambiente e di sicurezza, funzione antigelo, maniglia","0","34.99","0","0","1665592861.33046",NA
"502","B0987BTDT2","Imetec Silent Power Eco, Termoventilatore Silenzioso, Stufetta Elettrica, Tecnologia ECO -35% Consumo Energetico, 2100 W, Funzione Antigelo, Temperatura Regolabile, 4 Funzioni, Termostato Ambiente","0","52.99","0","0","1665592884.03267",NA
"503","B0987C6H2S","Imetec Silent Power Pure, Termoventilatore silenzioso con ionizzatore e timer di autospegnimento, Stufetta Elettrica, 2100 W, funzione antigelo, temperatura regolabile, 4 funzioni","0","80.99","0","0","1665592906.3556",NA
"504","B0987D9K2X","Imetec Silent Power Protection, Termoventilatore silenzioso, 2100 W, Stufetta Elettrica, Timer spegnimento programmabile, temperatura regolabile, 4 funzioni, termostato ambiente, funzione antigelo","0","60.99","0","0","1665592928.88017",NA
"505","B0987D6J4J","Imetec Compact Air, Termoventilatore piccolo e potente, Stufetta Elettrica, 2000 W, maniglia integrata, temperatura regolabile, funzione antigelo, dispositivo di protezione dai surriscaldamenti","0","24.99","0","0","1665592951.43734",NA
"506","B09CYM6KR3","Imetec FrullaRapido+, Frullatore a Immersione, Gambo XL in Acciaio, Lame in Acciaio Inox, Funzionamento a Impulsi, Bicchiere graduato da 700 ml BPA Free, 800 W","0","30.99","0","0","1665592973.85133",NA
"507","B09CYDKRZ6","Imetec FrullaFacile, Frullatore a Immersione, Gambo XL, Lame in Acciaio Inox, Funzionamento a Impulsi, Bicchiere Graduato da 700 ml BPA Free, 800 W, Impugnatura Ergonomica","0",NA,"0","0","1665592995.41166",NA
"508","B09CTZF711","Imetec Intellisense Comfort, Termoforo Multiuso, Cuscino Termico, per schiena e addome, Tasca per Mani, Rapido Riscaldamento, Tessuto Anallergico, 5 temperature, Electro Block di sicurezza, Lavabile","0","34.99","0","0","1665593017.50283",NA
"509","B09CTZM9LJ","Imetec Intellisense XL, Termoforo Extra Large Schiena e Gambe, Cuscino termico, 38x50 cm, Tessuto micro Peluche, 5 Temperature, Electro Block di sicurezza, Riscaldamento Rapido, lavabile in lavatrice","0","50.99","0","0","1665593039.94399",NA
"510","B09CTZV4TM","Imetec Intellisense Cervical, Termoforo per Cervicale e Spalle, Cuscino Termico, 47x52 cm, Tessuto Anallergico, 5 Temperature, Electro Block di Sicurezza, Riscaldamento Rapido, Lavabile in Lavatrice","0","47.99","0","0","1665593062.41155",NA
"511","B08X6QMR36","Imetec Onda F1, Ferro da Stiro a Vapore con Piastra a Onde Scorrevole Brevettata, 2400 W, Colpo di Vapore 200g, Serbatoio 300 ml, Tripla Protezione Anticalcare","0","77.94","0","0","1665593084.44018",NA
"512","B08X6ZDL24","Imetec Onda P1 Ferro da Stiro Generatore di Vapore, Piastra a Onde Scorrevole Brevettata, 2400W, Colpo Vapore 300g, Serbatoio 2.5L, 3 Filtri con Ioni di Argento, Tecnologia No Stop Vapor","0","104.74","0","0","1665593106.85768",NA
"513","B08JZ99BSG","Imetec Piuma Extreme++ SC3-500, Aspirapolvere con Tecnologia Ciclonica Senza Sacco, Regolazione Elettronica della Potenza, Leggera 4 kg, Doppio Filtro Hepa Ipoallergenico, Nero","0","74","0","0","1665593129.52442",NA
"514","B0987C1JFD","Imetec Eco Ceramic, Termoventilatore, Stufetta elettrica, Tecnologia Ceramica, Basso Consumo Energetico, Silenzioso, 3 Livelli di Temperatura, Termostato Ambiente","0","52.99","0","0","1665593151.42918",NA
"515","B0987BBB14","Imetec Eco Ceramic Diffusion, Stufetta elettrica, Termoventilatore, Corpo Oscillante, Tecnologia Ceramica, Basso Consumo Energetico, 6 Funzioni di Temperatura, Timer, Bianco/Nero","0","102.27","0","0","1665593173.53225",NA
"516",NA,NA,NA,NA,NA,NA,NA,NA
"517","B09KV6G5KT","Imetec Intellisense Comfort, Termoforo Multiuso, Cuscino Termico, Tessuto Anallergico, 5 temperature, Electro Block di sicurezza, Lavabile, grigio, 40x35 cm","0","44.99","0","0","1665593658.39884",NA
"518","B09N2JV9X3","Imetec Pro, Bilancia Pesapersone Meccanica, Rileva il Peso in Modo Chiaro e Affidabile, Pedana Antiscivolo, Portata max 150 kg, Divisione 1 kg","0","55.76","0","0","1665593681.06406",NA
"519","B09K7ZS81N","Imetec FriggiLeggero - Friggitrice ad aria multifunzione, 12 programmi, Riscaldamento rapido, 18 L, 1550 W, Comandi digitali, Cestello, Griglia, Leccarda, Ricettario, 40x36x34,5 cm","0","199.99","0","0","1665593703.48199",NA
"520","B09GTTY863","Imetec Scaldasonno Adapto Maxi Coprimaterasso Singolo 195x90 cm, Riscaldamento Rapido & Scaldasonno Adapto Singolo 150 x 80 Cm, Tecnologia Brevettata, Riscaldamento Rapido","0","94.99","0","0","1665593725.70094",NA
"521","B08TZZ3PR8","imetec Relaxy Intellisense Termoforo Multifunzione, Beige","0","29.99","0","0","1665593747.5884",NA
